{"_D":"urn:oasis:names:specification:ubl:schema:xsd:RequestForQuotation-2",
 "_A":"urn:oasis:names:specification:ubl:schema:xsd:CommonAggregateComponents-2",
 "_B":"urn:oasis:names:specification:ubl:schema:xsd:CommonBasicComponents-2",
 "RequestForQuotation":{
 "UBLVersionID":{"_":"2.1"},
 "CustomizationID":{"_":"OIOUBL-2.1"},
 "ProfileID":{"_":"Procurement-QuoSim-1.0",
  "schemeAgencyID":"320",
  "schemeID":"urn:oioubl:id:profileid-1.2"},
 "ID":{"_":"G867B"},
 "CopyIndicator":{"_":false},
 "UUID":{"_":"93T5G3G5-HYA3-7267-BVG3-GS46SW44WG53"},
 "IssueDate":{"_":"2008-04-19"},
 "IssueTime":{"_":"11:32:26.0Z"},
 "SubmissionDueDate":{"_":"2008-04-24"},
 "Note":[{"_":"Bestilling af computere"}],
 "PricingCurrencyCode":{"_":"DKK"},
 "OriginatorCustomerParty":{
  "Party":{
   "EndpointID":{"_":"5798000416604",
    "schemeAgencyID":"9",
    "schemeID":"GLN"},
   "PartyIdentification":[{
    "ID":{"_":"5798000416604",
     "schemeAgencyID":"9",
     "schemeID":"GLN"}
   }],
   "PartyName":[{
    "Name":{"_":"Gentofte Kommune"}
   }],
   "PostalAddress":{
    "AddressFormatCode":{"_":"StructuredDK",
     "listAgencyID":"320",
     "listID":"urn:oioubl:codelist:addressformatcode-1.1"},
    "StreetName":{"_":"Bernstorffsvej"},
    "BuildingNumber":{"_":"161"},
    "CityName":{"_":"Charlottenlund"},
    "PostalZone":{"_":"2920"},
    "Country":{
     "IdentificationCode":{"_":"DK"}
    }
   },
   "PartyTaxScheme":[{
    "CompanyID":{"_":"DK12345678",
     "schemeID":"DK:SE"},
    "TaxScheme":{
     "ID":{"_":"63",
      "schemeAgencyID":"320",
      "schemeID":"urn:oioubl:id:taxschemeid-1.1"},
     "Name":{"_":"Moms"}
    }
   }],
   "PartyLegalEntity":[{
    "RegistrationName":{"_":"Gentofte Kommune"},
    "CompanyID":{"_":"DK12345678",
     "schemeID":"DK:CVR"}
   }],
   "Contact":{
    "ID":{"_":"12345678"},
    "Name":{"_":"Sille Schyberg"}
   }
  }
 },
 "SellerSupplierParty":{
  "CustomerAssignedAccountID":{"_":"LEV00123"},
  "Party":{
   "EndpointID":{"_":"DK18296799",
    "schemeID":"DK:CVR"},
   "PartyIdentification":[{
    "ID":{"_":"DK18296799",
     "schemeID":"DK:CVR"}
   }],
   "PartyName":[{
    "Name":{"_":"Delcomputer A/S"}
   }],
   "PostalAddress":{
    "AddressFormatCode":{"_":"StructuredDK",
     "listAgencyID":"320",
     "listID":"urn:oioubl:codelist:addressformatcode-1.1"},
    "StreetName":{"_":"Arne Jacobsens Allé"},
    "BuildingNumber":{"_":"15"},
    "CityName":{"_":"København S"},
    "PostalZone":{"_":"2300"},
    "Country":{
     "IdentificationCode":{"_":"DK"}
    }
   },
   "PartyTaxScheme":[{
    "CompanyID":{"_":"DK18296799",
     "schemeID":"DK:SE"},
    "TaxScheme":{
     "ID":{"_":"63",
      "schemeAgencyID":"320",
      "schemeID":"urn:oioubl:id:taxschemeid-1.1"},
     "Name":{"_":"Moms"}
    }
   }],
   "PartyLegalEntity":[{
    "RegistrationName":{"_":"Delcomputer A/S"},
    "CompanyID":{"_":"DK18296799",
     "schemeID":"DK:CVR"}
   }]
  }
 },
 "Delivery":[{
  "DeliveryAddress":{
   "AddressFormatCode":{"_":"StructuredDK",
    "listAgencyID":"320",
    "listID":"urn:oioubl:codelist:addressformatcode-1.1"},
   "StreetName":{"_":"Bernstorffsvej"},
   "BuildingNumber":{"_":"161"},
   "CityName":{"_":"Charlottenlund"},
   "PostalZone":{"_":"2920"},
   "AddressLine":[{
    "Line":{"_":"1. sal"}
   },{
    "Line":{"_":"IT-afdelingen"}
   }],
   "Country":{
    "IdentificationCode":{"_":"DK"}
   }
  },
  "RequestedDeliveryPeriod":{
   "StartDate":{"_":"2008-05-06"},
   "StartTime":{"_":"09:30:47.0Z"},
   "EndDate":{"_":"2008-05-10"},
   "EndTime":{"_":"09:30:47.0Z"}
  }
 }],
 "DeliveryTerms":[{
  "SpecialTerms":[{"_":"1% reduktion i kontraktsummen pr. dags forsinkelse jf. SKI kontrakt"}]
 }],
 "Contract":[{
  "ContractDocumentReference":[{
   "ID":{"_":"SKI123456"},
   "IssueDate":{"_":"2006-01-01"}
  }]
 }],
 "RequestForQuotationLine":[{
  "ID":{"_":"1"},
  "Note":[{"_":"Computer"}],
  "LineItem":{
   "ID":{"_":"DELL1052665"},
   "Quantity":{"_":35,
    "unitCode":"NIU"},
   "Item":{
    "Description":[{"_":"Stationær computer"}],
    "Name":{"_":"Dell PrecisionTM  T3400"}
   }
  }
 },{
  "ID":{"_":"2"},
  "Note":[{"_":"Skærm"}],
  "LineItem":{
   "ID":{"_":"DELL2363463"},
   "Quantity":{"_":35,
    "unitCode":"NIU"},
   "Item":{
    "Description":[{"_":"Fladskærm"}],
    "Name":{"_":"FP/BL 1908WFP"}
   }
  }
 },{
  "ID":{"_":"3"},
  "Note":[{"_":"Mus"}],
  "LineItem":{
   "ID":{"_":"DELL2367452"},
   "Quantity":{"_":35,
    "unitCode":"NIU"},
   "Item":{
    "Description":[{"_":"Mus"}],
    "Name":{"_":"Dell Quietkey USB-tastatur, sort - Dansk (QWERTY)"}
   }
  }
 },{
  "ID":{"_":"4"},
  "Note":[{"_":"Tastatur"}],
  "LineItem":{
   "ID":{"_":"DELL8436783"},
   "Quantity":{"_":35,
    "unitCode":"NIU"},
   "Item":{
    "Description":[{"_":"Tastatur"}],
    "Name":{"_":"Dell Quietkey USB-tastatur, sort - Dansk (QWERTY)"}
   }
  }
 }]
}}